{
  "schema_version": 1,
  "observed_at": "2026-10-20",
  "source_url": "https://chatgpt.com/images/",
  "evidence_type": "observed_ui",
  "method": "Derived from saved native CUA accessibility and rendered modal text; no hidden state.",
  "scope": "Current 2026-10-20 inventory; not equivalent to the historical 2026-10-19 snapshot of 56 prompts.",
  "limitations": [
    "Modal prompts and controls do not establish conversational question sets or universal branch rules.",
    "User-specific probe inputs are deliberately excluded from portable defaults.",
    "Source references identify repository evidence; that documentation is not bundled when copying this skill alone.",
    "No image generation or output quality is established by the catalog."
  ],
  "cards": [
    {
      "name": "Cartaz",
      "category": "Modelos",
      "kind": "prompt_modal",
      "prompt_observed": "Crie um cartaz que expresse minha ideia com uma hierarquia clara, textos obrigatórios legíveis, imagens e tipografia que funcionem em conjunto no contexto de visualização previsto. Preserve todos os detalhes exatamente como foram fornecidos; não invente nomes, datas, locais, patrocinadores ou logotipos, nem inclua texto adicional.\n\nFaça perguntas para esclarecer e definir a mensagem, o conteúdo obrigatório, o layout e o estilo visual do cartaz. Apresente opções relevantes de layout e estilo visual quando disponíveis.",
      "prompt_status": "full_rendered_modal_text_verified",
      "controls_observed": {
        "aspect_ratios": [
          "Automático",
          "1:1",
          "2:3",
          "3:2",
          "16:9",
          "9:16"
        ],
        "default": "Automático",
        "photo_controls": [
          "Enviar uma foto",
          "Foto 1",
          "Foto 2",
          "Foto 3",
          "Foto 4"
        ]
      },
      "flow_status": "bounded_conversation_response_observed",
      "source_refs": [
        {
          "repository_relative_file": "docs/validation/image-card-flows-20261020/modelos-modal.json",
          "card_name": "Cartaz"
        }
      ],
      "clarification_instruction": "explicit_in_observed_prompt",
      "question_observations": {
        "observed_at": "2026-10-20",
        "universal": false,
        "usage": "contextual_examples_not_requirements",
        "questions": [
          {
            "text": "Qual é a ideia central?",
            "usage": "contextual_example_not_requirement",
            "details": "O que o cartaz deve comunicar e o que você quer provocar em quem o vê: curiosidade, impacto, reflexão, identificação, vontade de participar ou outra reação?"
          },
          {
            "text": "Qual é o texto obrigatório?",
            "usage": "contextual_example_not_requirement",
            "details": "Cole o texto completo exatamente como deverá aparecer, incluindo grafia, pontuação e maiúsculas. Se houver uma frase ou informação que deva receber mais destaque, indique."
          },
          {
            "text": "Onde e por quem ele será visto?",
            "usage": "contextual_example_not_requirement",
            "details": "Informe o uso previsto: impressão, publicação no Instagram, story, WhatsApp, tela ou outro contexto. Diga também quem é o público e, se houver, o tamanho obrigatório. Se ainda não souber as dimensões, basta informar o uso."
          },
          {
            "text": "Qual composição você prefere?",
            "usage": "contextual_example_not_requirement",
            "options": [
              {
                "value": "A",
                "label": "Texto protagonista",
                "description": "Tipografia ocupa a maior parte do cartaz; imagens e elementos gráficos têm papel de apoio."
              },
              {
                "value": "B",
                "label": "Imagem protagonista",
                "description": "Uma imagem concentra a atenção; o texto entra em uma área de leitura bem definida."
              },
              {
                "value": "C",
                "label": "Composição editorial",
                "description": "Texto e imagem dividem o espaço, com alinhamentos precisos e hierarquia organizada."
              },
              {
                "value": "D",
                "label": "Composição dinâmica",
                "description": "Assimetria, diferenças de escala e uso expressivo do espaço criam movimento e tensão visual."
              }
            ]
          },
          {
            "text": "Que linguagem visual combina com sua ideia?",
            "usage": "contextual_example_not_requirement",
            "options": [
              {
                "label": "Minimalista",
                "description": "poucos elementos, bastante espaço livre e contraste controlado."
              },
              {
                "label": "Artística e poética",
                "description": "metáfora visual, textura e significados sugeridos."
              },
              {
                "label": "Gráfica e contundente",
                "description": "formas marcantes, tipografia forte e contraste alto."
              },
              {
                "label": "Fotográfica",
                "description": "fotografia como base, com tratamento de luz e cor coerente com a mensagem."
              },
              {
                "label": "Retrô e impressa",
                "description": "linguagem de cartazes antigos, gravura, colagem ou serigrafia."
              }
            ]
          },
          {
            "text": "O que deve ser usado ou evitado?",
            "usage": "contextual_example_not_requirement",
            "details": "Anexe imagens, referências ou logotipos que devam entrar no cartaz. Informe também cores obrigatórias, elementos proibidos e qualquer preferência de tipografia. Se enviar uma referência, diga o que deseja aproveitar nela: composição, cores, fonte, imagem ou atmosfera."
          }
        ],
        "option_tables": [],
        "source_refs": [
          {
            "repository_relative_file": "docs/validation/image-card-flows-20261020/probes.json",
            "card_name": "Cartaz"
          }
        ],
        "limitations": [
          "Only completed captured responses supply these examples. Association and nesting should be checked against repository raw Markdown."
        ]
      }
    },
    {
      "name": "Design de interiores",
      "category": "Modelos",
      "kind": "prompt_modal",
      "prompt_observed": "Crie uma visualização de design de interiores que mostre como meu espaço poderia ficar e funcionar. Preserve a arquitetura existente e as proporções do ambiente; não invente alterações estruturais, aberturas, elementos fixos ou dimensões.\n\nPeça uma foto ou descrição do ambiente e depois faça perguntas para esclarecer como o espaço é usado, quais mudanças são desejadas ou quais restrições existem, quais itens devem ser preservados e qual é o estilo de decoração. Apresente opções relevantes de estilos de decoração quando disponíveis.",
      "prompt_status": "full_rendered_modal_text_verified",
      "controls_observed": {
        "aspect_ratios": [
          "Automático",
          "1:1",
          "2:3",
          "3:2",
          "16:9",
          "9:16"
        ],
        "default": "Automático",
        "photo_controls": [
          "Enviar uma foto",
          "Foto 1",
          "Foto 2",
          "Foto 3",
          "Foto 4"
        ]
      },
      "flow_status": "bounded_conversation_response_observed",
      "source_refs": [
        {
          "repository_relative_file": "docs/validation/image-card-flows-20261020/modelos-modal.json",
          "card_name": "Design de interiores"
        }
      ],
      "clarification_instruction": "explicit_in_observed_prompt",
      "question_observations": {
        "observed_at": "2026-10-20",
        "universal": false,
        "usage": "contextual_examples_not_requirements",
        "questions": [
          {
            "text": "Envie uma foto do ambiente que você quer transformar — ou uma descrição, se preferir.",
            "usage": "contextual_example_not_requirement"
          }
        ],
        "option_tables": [
          {
            "headers": [
              "Estilo",
              "Características"
            ],
            "rows": [
              {
                "Estilo": "Contemporâneo acolhedor",
                "Características": "Linhas simples, madeira, tecidos e iluminação suave."
              },
              {
                "Estilo": "Minimalista",
                "Características": "Poucos elementos, superfícies livres e organização visual."
              },
              {
                "Estilo": "Escandinavo",
                "Características": "Tons claros, madeira clara e mobiliário funcional."
              },
              {
                "Estilo": "Industrial",
                "Características": "Metal, madeira e acabamentos de aparência mais bruta."
              },
              {
                "Estilo": "Clássico contemporâneo",
                "Características": "Formas elegantes, composição equilibrada e detalhes discretos."
              }
            ],
            "usage": "observed_options_not_exhaustive"
          }
        ],
        "source_refs": [
          {
            "repository_relative_file": "docs/validation/image-card-flows-20261020/probes.json",
            "card_name": "Design de interiores"
          }
        ],
        "limitations": [
          "Only completed captured responses supply these examples. Association and nesting should be checked against repository raw Markdown."
        ]
      }
    },
    {
      "name": "Logo",
      "category": "Modelos",
      "kind": "prompt_modal",